<?xml version="1.0"?>
<!DOCTYPE Report
[
<!ELEMENT Report (General ,(Doc|BPT)) >
<!ATTLIST Report ver CDATA #REQUIRED tmZone CDATA #REQUIRED>

<!ELEMENT General ( DocLocation ) >
<!ATTLIST General productName CDATA #REQUIRED productVer CDATA #REQUIRED os CDATA #REQUIRED host CDATA #REQUIRED qcserver CDATA #IMPLIED qcproject CDATA #IMPLIED SolManSolutionId CDATA #IMPLIED SolManProjectId CDATA #IMPLIED SolManTestPlanId CDATA #IMPLIED SolManTestPackageId CDATA #IMPLIED SolManUserInfoData CDATA #IMPLIED  >

<!ELEMENT BPT (DName,Res,DVer?,TSet?,TInst?,NodeArgs,AdditionalInfo*,Doc*) >
<!ATTLIST BPT rID ID #REQUIRED >

<!ELEMENT Doc (DName,ConfName?,Res,DVer?,TSet?,TInst?,RunType?,DT?,AdditionalInfo*,Step*,DIter*,Step*,Action*,Doc*,Summary?,TestMaintenanceSummary*,NodeArgs?) >
<!ATTLIST Doc rID ID #REQUIRED type (Test|BC|BPTWrapperTest|Flow|Group|Action) "Test" productName CDATA #REQUIRED BCIter CDATA #IMPLIED >

<!ELEMENT RunType ( #PCDATA )>
<!ATTLIST RunType fmStep (False|True) "False" batch (False|True) "False" upDesc (False|True) "False" upChk (False|True) "False" upAS (False|True) "False">

<!ELEMENT DName ( #PCDATA ) >

<!ELEMENT ConfName ( #PCDATA ) >

<!ELEMENT Res ( #PCDATA ) >

<!ELEMENT AdditionalInfo (AdditionalDataName,AdditionalDataValue ) >

<!ELEMENT AdditionalDataName ( #PCDATA ) >

<!ELEMENT AdditionalDataValue ( #PCDATA ) >

<!ELEMENT DVer ( #PCDATA ) >

<!ELEMENT TSet ( #PCDATA ) >

<!ELEMENT TInst ( #PCDATA ) >

<!ELEMENT DIter (Step*,Action+,Summary?,NodeArgs)>
<!ATTLIST DIter rID ID #REQUIRED iterID CDATA #REQUIRED>

<!ELEMENT DocLocation ( #PCDATA )>

<!ELEMENT Action (AName,AIter*,(Step|HtmlStep|Action)*, Summary,ActionMaintenanceSummary*, NodeArgs ) >
<!ATTLIST Action rID ID #REQUIRED>

<!ELEMENT AIter ((Step|HtmlStep|Action)*,DataMapping?, Summary?,NodeArgs) >
<!ATTLIST AIter rID ID #REQUIRED iterID CDATA #REQUIRED isCountable (False|True) "False" >

<!ELEMENT AName ( #PCDATA ) >

<!ELEMENT TestMaintenanceSummary (ActionMaintenanceSummary*) >
<!ATTLIST TestMaintenanceSummary ObjectsAdded CDATA #REQUIRED ObjectsUpdated CDATA #REQUIRED StepsUpdated CDATA #REQUIRED StepsComments CDATA #REQUIRED><!ELEMENT ActionMaintenanceSummary (ObjectChange* ) >
<!ATTLIST ActionMaintenanceSummary Action CDATA #REQUIRED Objects CDATA #REQUIRED Updated CDATA #REQUIRED LinesTotal CDATA #REQUIRED Added CDATA #REQUIRED LinesUpdated CDATA #REQUIRED>

<!ELEMENT ObjectChange  (Hierarchy, PropertyChangeList* ) >
<!ATTLIST ObjectChange Operation CDATA #IMPLIED OriginalRepository CDATA #IMPLIED>

<!ELEMENT PropertyChangeList (PropertyDef*) >

<!ELEMENT PropertyDef (OriginalValue, NewValue) >
<!ATTLIST PropertyDef PropName CDATA #REQUIRED OriginRegularExpression (True|False) "False" NewRegularExpression (True|False) "False" AddedProperty (True|False) "False" >

<!ELEMENT OriginalValue ( #PCDATA )>

<!ELEMENT NewValue ( #PCDATA )>

<!ELEMENT Hierarchy  (ObjectName, Hierarchy*) >
<!ATTLIST Hierarchy MicClass CDATA #REQUIRED>

<!ELEMENT ObjectName  ( #PCDATA ) >

<!ELEMENT Step (Obj,Details,Time,TimeTick* ,(Step|HtmlStep|Doc)*, DataMapping?, NodeArgs) >
<!ATTLIST Step rID ID #REQUIRED retval CDATA #IMPLIED>

<!ELEMENT HtmlStep (HTML,TimeTick*,(Step|HtmlStep|Doc)*,NodeArgs) >
<!ATTLIST HtmlStep rID ID #REQUIRED >

<!ELEMENT Obj ( #PCDATA ) >
<!ATTLIST Obj plainTxt (False|True) "True">

<!ELEMENT Details ( #PCDATA ) >
<!ATTLIST Details plainTxt (False|True) "True">

<!ELEMENT Time ( #PCDATA ) >

<!ELEMENT HTML ( #PCDATA ) >

<!ELEMENT Disp ( #PCDATA ) >

<!ELEMENT TimeTick ( #PCDATA ) >

<!ELEMENT DataMapping ( DataMappedItem* )>
<!ELEMENT DataMappedItem EMPTY >
<!ATTLIST DataMappedItem dsName CDATA #REQUIRED >
<!ATTLIST DataMappedItem rowId CDATA #REQUIRED >

<!ELEMENT NodeArgs (Disp,TopPane?,BtmPane?,ExtendedInfo? )>
<!ATTLIST NodeArgs eType CDATA #REQUIRED icon CDATA #REQUIRED nRep CDATA #REQUIRED UserNote CDATA #IMPLIED filter (False|True) "True">
<!ATTLIST NodeArgs status (Passed|Failed|Done|Warning|Information) "Done">
<!ATTLIST NodeArgs iconSel CDATA #IMPLIED nType CDATA #IMPLIED MovieMarker CDATA "">
<!ATTLIST NodeArgs Source CDATA #IMPLIED SourceLine CDATA #IMPLIED StepFlowItemKey CDATA #IMPLIED >

<!ELEMENT TopPane (Path)>

<!ELEMENT BtmPane ( (Path|WR)?,ASHilite?)>
<!ATTLIST BtmPane vType CDATA "HTML">

<!ELEMENT Path ( #PCDATA ) >

<!ELEMENT ASHilite ( #PCDATA ) >

<!ELEMENT WR ( #PCDATA ) >

<!ELEMENT ExtendedInfo ( StepData ) >

<!ATTLIST ExtendedInfo StepType CDATA #REQUIRED>
<!ELEMENT DT (NodeArgs) >
<!ATTLIST DT rID ID #REQUIRED>

<!ELEMENT Summary (Param*)>
<!ATTLIST Summary sTime CDATA #IMPLIED eTime CDATA #IMPLIED passed CDATA #IMPLIED failed CDATA #IMPLIED warnings CDATA #IMPLIED retval CDATA #IMPLIED stopped (False|True) "False" >

<!ELEMENT Param (ParamName,ParamVal)+ >
<!ATTLIST Param paramInOut (In|Out) "In">

<!ELEMENT ParamName ( #PCDATA ) >

<!ELEMENT ParamVal ( #PCDATA ) >

]
>
<Report ver="2.0" tmZone="India Standard Time">
<General productName="HP Unified Functional Testing" productVer="12.53" os="Windows 7" host="ULTP_722"><DocLocation><![CDATA[E:\Sprint\Scripts\Costco\Login Security and Supplemental Roles\C150002\Preconditions_C150002_EPS]]></DocLocation></General>
<Doc rID="T1"   productName= "HP Unified Functional Testing"  >
<DName><![CDATA[Preconditions_C150002_EPS]]></DName>
<Res><![CDATA[Res7]]></Res>
<RunType fmStep="True" /><DT rID="T2">
<NodeArgs eType="Table" icon="2" nRep="4" filter="False" >
<Disp><![CDATA[Run-Time Data Table]]></Disp>
<BtmPane vType="Table" >
<Path><![CDATA[Default.xls]]></Path>
</BtmPane>
</NodeArgs>
</DT>
<Action rID="T3">
<AName><![CDATA[Action1]]></AName>
<Step rID="T4">
<Obj plainTxt="False" ><![CDATA[Run Error]]></Obj>
<Details plainTxt="False" ><![CDATA[The retrieve DataTable.Value operation failed. The &lt;UserName&gt; column does not exist.<BR/>Line (267): &quot;username = DataTable.Value(&quot;UserName&quot;,&quot;Global&quot;)&quot;. ]]></Details>
<Time><![CDATA[25-06-2017 - 13:58:24]]></Time>
<TimeTick>1498379304</TimeTick>
<NodeArgs eType="Replay" icon="4" nRep="7" status="Failed" Source="Action1" SourceLine="266" >
<Disp><![CDATA[Run Error]]></Disp>
</NodeArgs>
</Step>
<Step rID="T5">
<Obj plainTxt="False" ><![CDATA[Run Error]]></Obj>
<Details plainTxt="False" ><![CDATA[The retrieve DataTable.Value operation failed. The &lt;Password&gt; column does not exist.<BR/>Line (268): &quot;password = DataTable.Value(&quot;Password&quot;,&quot;Global&quot;)&quot;. ]]></Details>
<Time><![CDATA[25-06-2017 - 13:58:26]]></Time>
<TimeTick>1498379306</TimeTick>
<NodeArgs eType="Replay" icon="4" nRep="8" status="Failed" Source="Action1" SourceLine="267" >
<Disp><![CDATA[Run Error]]></Disp>
</NodeArgs>
</Step>
<Step rID="T6">
<Obj plainTxt="False" ><![CDATA[Certificate Error: Navigation]]></Obj>
<Details plainTxt="False" ><![CDATA[Browser]]></Details>
<Time><![CDATA[25-06-2017 - 13:58:32]]></Time>
<TimeTick>1498379312</TimeTick>
<Step rID="T7">
<Obj plainTxt="False" ><![CDATA["Certificate Error: Navigation"- Smart Identification]]></Obj>
<Details plainTxt="False" ><![CDATA[<P><span class="text">The smart identification mechanism was invoked.</span></P><P><SPAN class=text>Reason: object not unique (5 objects found)</SPAN></P>           <SPAN class=text><b>Original description:</b></SPAN><br>micclass=Browser<br><P><FONT face=Verdana size=2><SPAN class=text><B>Smart Identification Alternative Description: </B></SPAN></FONT></P><FONT face=Verdana size=2><u>Base filter properties (5 objects found)&nbsp;</FONT></u><br>
micclass=Browser<br><br><FONT face=Verdana size=2><u>Optional filter properties</FONT></u><br>
name=Certificate Error: Navigation Blocked<SPAN class=passed> (Used</SPAN>, 1 matches)</SPAN><br>title=https://192.168.109.121:58442/ecc/<SPAN class=warning> (Ignored)<FONT color=#000000></FONT></SPAN><br>openurl=http://www.msn.com/en-in/?ocid=iehp<SPAN class=warning> (Ignored)<FONT color=#000000></FONT></SPAN><br>opentitle=MSN India | Hotmail, Outlook, Skype, news, photos & videos<SPAN class=warning> (Ignored)<FONT color=#000000></FONT></SPAN><br>hasstatusbar=0<SPAN class=warning> (Ignored)<FONT color=#000000></FONT></SPAN><br>hasmenubar=-1<SPAN class=warning> (Ignored)<FONT color=#000000></FONT></SPAN><br>hastoolbar=-1<SPAN class=warning> (Ignored)<FONT color=#000000></FONT></SPAN><br>openedbytestingtool=0<SPAN class=warning> (Ignored)<FONT color=#000000></FONT></SPAN><br>number of tabs=1<SPAN class=warning> (Ignored)<FONT color=#000000></FONT></SPAN><br>]]></Details>
<Time><![CDATA[25-06-2017 - 13:58:32]]></Time>
<TimeTick>1498379312</TimeTick>
<NodeArgs eType="Replay" icon="6" nRep="10" >
<Disp><![CDATA["Certificate Error: Navigation"- Smart Identification]]></Disp>
</NodeArgs>
</Step>
<Step rID="T8">
<Obj plainTxt="False" ><![CDATA[Certificate Error: Navigation]]></Obj>
<Details plainTxt="False" ><![CDATA[Page]]></Details>
<Time><![CDATA[25-06-2017 - 13:58:32]]></Time>
<TimeTick>1498379312</TimeTick>
<Step rID="T9">
<Obj plainTxt="False" ><![CDATA[Continue to this website.Exist]]></Obj>
<Details plainTxt="False" ><![CDATA["Object exists"]]></Details>
<Time><![CDATA[25-06-2017 - 13:58:32]]></Time>
<TimeTick>1498379312</TimeTick>
<NodeArgs eType="Replay" icon="8" nRep="13" >
<Disp><![CDATA[Continue to this website.Exist]]></Disp>
</NodeArgs>
</Step>
<Step rID="T10">
<Obj plainTxt="False" ><![CDATA[Continue to this website.Click]]></Obj>
<Details plainTxt="False" ><![CDATA[]]></Details>
<Time><![CDATA[25-06-2017 - 13:58:32]]></Time>
<TimeTick>1498379312</TimeTick>
<NodeArgs eType="Replay" icon="8" nRep="16" >
<Disp><![CDATA[Continue to this website.Click]]></Disp>
</NodeArgs>
</Step>
<NodeArgs eType="Context" icon="7" nRep="12" >
<Disp><![CDATA[Certificate Error: Navigation]]></Disp>
</NodeArgs>
</Step>
<NodeArgs eType="Context" icon="5" nRep="9" >
<Disp><![CDATA[Certificate Error: Navigation]]></Disp>
</NodeArgs>
</Step>
<Step rID="T11">
<Obj ><![CDATA[Certificate Error]]></Obj>
<Details ><![CDATA[Certificate Error button has been clicked]]></Details>
<Time><![CDATA[25-06-2017 - 13:58:32]]></Time>
<TimeTick>1498379312</TimeTick>
<NodeArgs eType="User" icon="9" nRep="17" >
<Disp><![CDATA[Certificate Error]]></Disp>
</NodeArgs>
</Step>
<Step rID="T12">
<Obj plainTxt="False" ><![CDATA[Certificate Error: Navigation]]></Obj>
<Details plainTxt="False" ><![CDATA[Browser]]></Details>
<Time><![CDATA[25-06-2017 - 13:58:48]]></Time>
<TimeTick>1498379328</TimeTick>
<Step rID="T13">
<Obj plainTxt="False" ><![CDATA[Enterprise Control Center]]></Obj>
<Details plainTxt="False" ><![CDATA[Page]]></Details>
<Time><![CDATA[25-06-2017 - 13:58:48]]></Time>
<TimeTick>1498379328</TimeTick>
<Step rID="T14">
<Obj plainTxt="False" ><![CDATA[username.WaitProperty]]></Obj>
<Details plainTxt="False" ><![CDATA["visible", True, True, 20000]]></Details>
<Time><![CDATA[25-06-2017 - 13:58:49]]></Time>
<TimeTick>1498379329</TimeTick>
<NodeArgs eType="Replay" icon="10" nRep="22" >
<Disp><![CDATA[username.WaitProperty]]></Disp>
</NodeArgs>
</Step>
<Step rID="T15">
<Obj plainTxt="False" ><![CDATA[username.Set]]></Obj>
<Details plainTxt="False" ><![CDATA[""]]></Details>
<Time><![CDATA[25-06-2017 - 13:58:49]]></Time>
<TimeTick>1498379329</TimeTick>
<NodeArgs eType="Replay" icon="10" nRep="25" >
<Disp><![CDATA[username.Set]]></Disp>
</NodeArgs>
</Step>
<Step rID="T16">
<Obj plainTxt="False" ><![CDATA[password.Set]]></Obj>
<Details plainTxt="False" ><![CDATA[""]]></Details>
<Time><![CDATA[25-06-2017 - 13:58:49]]></Time>
<TimeTick>1498379329</TimeTick>
<NodeArgs eType="Replay" icon="10" nRep="28" >
<Disp><![CDATA[password.Set]]></Disp>
</NodeArgs>
</Step>
<Step rID="T17">
<Obj plainTxt="False" ><![CDATA[OK.Exist]]></Obj>
<Details plainTxt="False" ><![CDATA["Object exists"]]></Details>
<Time><![CDATA[25-06-2017 - 13:58:49]]></Time>
<TimeTick>1498379329</TimeTick>
<NodeArgs eType="Replay" icon="11" nRep="30" >
<Disp><![CDATA[OK.Exist]]></Disp>
</NodeArgs>
</Step>
<Step rID="T18">
<Obj plainTxt="False" ><![CDATA[OK.Click]]></Obj>
<Details plainTxt="False" ><![CDATA[]]></Details>
<Time><![CDATA[25-06-2017 - 13:58:49]]></Time>
<TimeTick>1498379329</TimeTick>
<NodeArgs eType="Replay" icon="11" nRep="33" >
<Disp><![CDATA[OK.Click]]></Disp>
</NodeArgs>
</Step>
<NodeArgs eType="Context" icon="7" nRep="21" >
<Disp><![CDATA[Enterprise Control Center]]></Disp>
</NodeArgs>
</Step>
<Step rID="T19">
<Obj plainTxt="False" ><![CDATA[Enterprise Control Center_2]]></Obj>
<Details plainTxt="False" ><![CDATA[Page]]></Details>
<Time><![CDATA[25-06-2017 - 13:58:59]]></Time>
<TimeTick>1498379339</TimeTick>
<Step rID="T20">
<Obj plainTxt="False" ><![CDATA[header-form:j_id105:anchor.Click]]></Obj>
<Details plainTxt="False" ><![CDATA[]]></Details>
<Time><![CDATA[25-06-2017 - 13:58:59]]></Time>
<TimeTick>1498379339</TimeTick>
<NodeArgs eType="Replay" icon="12" nRep="37" Source="Action1" SourceLine="281" >
<Disp><![CDATA[header-form:j_id105:anchor.Click]]></Disp>
</NodeArgs>
</Step>
<Step rID="T21">
<Obj plainTxt="False" ><![CDATA[searchForm:roleSearch.WaitProperty]]></Obj>
<Details plainTxt="False" ><![CDATA["visible", True, True, 20000]]></Details>
<Time><![CDATA[25-06-2017 - 13:59:00]]></Time>
<TimeTick>1498379340</TimeTick>
<NodeArgs eType="Replay" icon="10" nRep="40" Source="Action1" SourceLine="285" >
<Disp><![CDATA[searchForm:roleSearch.WaitProperty]]></Disp>
</NodeArgs>
</Step>
<NodeArgs eType="Context" icon="7" nRep="36" Source="Action1" SourceLine="281" >
<Disp><![CDATA[Enterprise Control Center_2]]></Disp>
</NodeArgs>
</Step>
<NodeArgs eType="Context" icon="5" nRep="20" >
<Disp><![CDATA[Certificate Error: Navigation]]></Disp>
</NodeArgs>
</Step>
<Step rID="T22">
<Obj plainTxt="False" ><![CDATA[Run Error]]></Obj>
<Details plainTxt="False" ><![CDATA[The retrieve DataTable.Value operation failed. The &lt;SupplementalRole2&gt; column does not exist.<BR/>Line (288): &quot;Browser(&quot;Certificate Error: Navigation&quot;).Page(&quot;Enterprise Control Center_2&quot;).WebEdit(&quot;searchForm:roleSearch&quot;).Set DataTable.Value(&quot;SupplementalRole2&quot;,&quot;Global&quot;)&quot;. ]]></Details>
<Time><![CDATA[25-06-2017 - 13:59:00]]></Time>
<TimeTick>1498379340</TimeTick>
<NodeArgs eType="Replay" icon="4" nRep="41" status="Failed" Source="Action1" SourceLine="287" >
<Disp><![CDATA[Run Error]]></Disp>
</NodeArgs>
</Step>
<Step rID="T23">
<Obj plainTxt="False" ><![CDATA[Certificate Error: Navigation]]></Obj>
<Details plainTxt="False" ><![CDATA[Browser]]></Details>
<Time><![CDATA[25-06-2017 - 13:59:24]]></Time>
<TimeTick>1498379364</TimeTick>
<Step rID="T24">
<Obj plainTxt="False" ><![CDATA[Enterprise Control Center_2]]></Obj>
<Details plainTxt="False" ><![CDATA[Page]]></Details>
<Time><![CDATA[25-06-2017 - 13:59:24]]></Time>
<TimeTick>1498379364</TimeTick>
<Step rID="T25">
<Obj plainTxt="False" ><![CDATA[Search.Exist]]></Obj>
<Details plainTxt="False" ><![CDATA["Object exists"]]></Details>
<Time><![CDATA[25-06-2017 - 13:59:24]]></Time>
<TimeTick>1498379364</TimeTick>
<NodeArgs eType="Replay" icon="13" nRep="45" Source="Action1" SourceLine="287" >
<Disp><![CDATA[Search.Exist]]></Disp>
</NodeArgs>
</Step>
<Step rID="T26">
<Obj plainTxt="False" ><![CDATA[Search.Click]]></Obj>
<Details plainTxt="False" ><![CDATA[]]></Details>
<Time><![CDATA[25-06-2017 - 13:59:24]]></Time>
<TimeTick>1498379364</TimeTick>
<NodeArgs eType="Replay" icon="13" nRep="48" Source="Action1" SourceLine="290" >
<Disp><![CDATA[Search.Click]]></Disp>
</NodeArgs>
</Step>
<Step rID="T27">
<Obj plainTxt="False" ><![CDATA[Remove.Exist]]></Obj>
<Details plainTxt="False" ><![CDATA["Object exists"]]></Details>
<Time><![CDATA[25-06-2017 - 13:59:26]]></Time>
<TimeTick>1498379366</TimeTick>
<NodeArgs eType="Replay" icon="8" nRep="50" Source="Action1" SourceLine="295" >
<Disp><![CDATA[Remove.Exist]]></Disp>
</NodeArgs>
</Step>
<Step rID="T28">
<Obj plainTxt="False" ><![CDATA[Remove.Click]]></Obj>
<Details plainTxt="False" ><![CDATA[]]></Details>
<Time><![CDATA[25-06-2017 - 13:59:26]]></Time>
<TimeTick>1498379366</TimeTick>
<NodeArgs eType="Replay" icon="8" nRep="53" Source="Action1" SourceLine="296" >
<Disp><![CDATA[Remove.Click]]></Disp>
</NodeArgs>
</Step>
<Step rID="T29">
<Obj plainTxt="False" ><![CDATA[WebTable.Exist]]></Obj>
<Details plainTxt="False" ><![CDATA["Object exists"]]></Details>
<Time><![CDATA[25-06-2017 - 13:59:26]]></Time>
<TimeTick>1498379366</TimeTick>
<NodeArgs eType="Replay" icon="12" nRep="55" Source="Action1" SourceLine="302" >
<Disp><![CDATA[WebTable.Exist]]></Disp>
</NodeArgs>
</Step>
<Step rID="T30">
<Obj plainTxt="False" ><![CDATA[WebTable.Click]]></Obj>
<Details plainTxt="False" ><![CDATA[]]></Details>
<Time><![CDATA[25-06-2017 - 13:59:26]]></Time>
<TimeTick>1498379366</TimeTick>
<NodeArgs eType="Replay" icon="12" nRep="58" Source="Action1" SourceLine="303" >
<Disp><![CDATA[WebTable.Click]]></Disp>
</NodeArgs>
</Step>
<NodeArgs eType="Context" icon="7" nRep="44" Source="Action1" SourceLine="287" >
<Disp><![CDATA[Enterprise Control Center_2]]></Disp>
</NodeArgs>
</Step>
<Step rID="T31">
<Obj plainTxt="False" ><![CDATA[Certificate Error: Navigation.Exist]]></Obj>
<Details plainTxt="False" ><![CDATA["Object exists"]]></Details>
<Time><![CDATA[25-06-2017 - 13:59:26]]></Time>
<TimeTick>1498379366</TimeTick>
<NodeArgs eType="Replay" icon="5" nRep="59" Source="Action1" SourceLine="306" >
<Disp><![CDATA[Certificate Error: Navigation.Exist]]></Disp>
</NodeArgs>
</Step>
<Step rID="T32">
<Obj plainTxt="False" ><![CDATA[Certificate Error: Navigation.Close]]></Obj>
<Details plainTxt="False" ><![CDATA[]]></Details>
<Time><![CDATA[25-06-2017 - 13:59:29]]></Time>
<TimeTick>1498379369</TimeTick>
<NodeArgs eType="Replay" icon="5" nRep="60" Source="Action1" SourceLine="307" >
<Disp><![CDATA[Certificate Error: Navigation.Close]]></Disp>
</NodeArgs>
</Step>
<NodeArgs eType="Context" icon="5" nRep="43" Source="Action1" SourceLine="287" >
<Disp><![CDATA[Certificate Error: Navigation]]></Disp>
</NodeArgs>
</Step>
<Summary sTime="25-06-2017 - 13:58:24" eTime="25-06-2017 - 13:59:30" passed="0" failed="3" warnings="0" ></Summary>
<NodeArgs eType="StartAction" icon="3" nRep="6" status="Failed" >
<Disp><![CDATA[Action1 Summary]]></Disp>
</NodeArgs>
</Action>
<Summary sTime="25-06-2017 - 13:58:23" eTime="25-06-2017 - 13:59:30" passed="0" failed="3" warnings="0" ></Summary>
<NodeArgs eType="StartTest" icon="1" nRep="3" status="Failed" >
<Disp><![CDATA[Test Preconditions_C150002_EPS Summary]]></Disp>
</NodeArgs>
</Doc>
</Report>